<?xml version="1.0"?>
<!DOCTYPE relacio SYSTEM "relacio.dtd">
<relacio>
    <persona sexe="home" identif="A01">
        <nom>LLu√≠s Merino</nom>
        <email>llm@gmail.com</email>
        <parentesc pare="B02 C03" />
    </persona>
    <persona sexe="home" identif="B02">
        <nom>Rodrigo Merino</nom>
        <email>rodrigo@gmail.com</email>
        <parentesc germa="C03" />
    </persona>
    <persona identif="C03">
        <nom>Ana Merino</nom>
        <email>anam@icloud.com</email>
        <parentesc germa="B02" />
    </persona>
</relacio> 